Model, Price, Shipping
Apple Laptop MacBook Pro With Touch Bar MPXY2LL/A Intel Core i5 3.10 GHz 8 GB...,N/A,N/A
Apple 13.3" MacBook Pro Touch Bar (Mid 2018) - Silver - MR9U2LL/A,N/A,N/A
Apple MacBook Pro with Touch Bar MR962LL/A Intel Core i7 2.2 GHz 16 GB Memory...,N/A,N/A
Apple MacBook Pro 13" Core i7 3.5 GHz/16GB Memory/1TB SSD - Space Gray,N/A,N/A
Refurbished: Apple Macbook Pro 13.3" 2.5 GHz Core i5| 500GB HDD| 4GB DDR3L RAM - MD101LL/A,$399.00,Free Shipping
Refurbished: Apple MacBook Pro 15" Retina - 2.5GHz Intel Core i7-4870HQ Quad| 16 GB RAM| 512 GB flash storage| AMD Radeon R9 M370X 2GB| Force Touch Trackpad| Mac OS X - A1398 MJLT2LL/A (Mid 2015) 3807449,$1599.99,Free Shipping
Apple MacBook Pro with Touch Bar MR962LL/A Intel Core i7 2.2 GHz 16 GB Memory 256 GB SSD AMD Radeon Pro 555X 15.4" macOS 10.13 High Sierra| Silver (Mid-2018),$2197.99,Free Shipping
Apple Laptop MacBook Pro With Touch Bar MPXY2LL/A Intel Core i5 3.10 GHz 8 GB Memory 512 GB SSD Intel Iris Plus Graphics 650 13.3" Mac OS X v10.12 Sierra,$1949.00,Free Shipping
Apple 13.3" MacBook Pro Touch Bar (Mid 2018) - Silver - MR9U2LL/A,$1694.00,Special Shipping
Refurbished: Apple Grade C Laptop MacBook Pro ME665LL/AU-C Intel Core i7 16 GB Memory 768 GB SSD 15.4" Mac OS X v10.8 Mountain Lion,$1253.00,$1.99 Shipping
Refurbished: Apple A Grade Laptop MacBook Pro RRMD101LL/A-A Intel Core i5 2nd Gen 2520M (2.50 GHz) 4 GB Memory 500 GB HDD 13.3" Mac OS X v10.8 Mountain Lion,$419.99,Free Shipping
Refurbished: Apple Laptop - Grade C MacBook Pro MD102LL/A-C Intel Core i7 3rd Gen 3520M (2.90 GHz) 8 GB Memory 750 GB HDD 13.3" Mac OS X v10.8 Mountain Lion,$441.00,Free Shipping
Apple MacBook Pro MC374LL/A 13.3" LED Notebook - Intel Core 2 Duo Dual-core (2 Core) 2.40 GHz - Aluminum,$849.95,Free Shipping
Refurbished: Apple Grade D Laptop MacBook Pro ME665LL/A-D Intel Core i7 2.70 GHz 16 GB Memory 512 GB SSD 15.4" Mac OS X v10.8 Mountain Lion,$659.99,$5.59 Shipping
Refurbished: Apple C Grade Laptop MacBook Pro RRMC975LL/A-C Intel Core i7 2.3 GHz 8 GB Memory 256 GB SSD 15.4" Mac OS X v10.7 Lion,$711.99,$1.99 Shipping
Refurbished: Apple MacBook Pro MacBook Pro A1278 Intel Core i5-3210M X2 2.5GHz 4GB 500GB| Silver,$489.00,Free Shipping
Apple Laptop MacBook Pro With Touch Bar MPTT2LL/A Intel Core i7 7th Gen 7820HQ (2.90 GHz) 16 GB Memory 512 GB SSD AMD Radeon Pro 560 15.4" Mac OS X v10.12 Sierra,$2599.99,Special Shipping
Apple Laptop MacBook Pro MPXQ2LL/A Intel Core i5 2.3 GHz 8 GB Memory 128 GB PCIe-based SSD Intel Iris Plus Graphics 640 13.3" Mac OS X v10.12 Sierra,$1199.00,Free Shipping
Open Box: Apple Laptop MacBook Pro MD101LL/A Intel Core i5 2.5 GHz 4 GB Memory 500 GB HDD Intel HD Graphics 4000 13.3" Mac OS X v10.7 Lion,$699.99,Free Shipping
Apple Laptop MacBook Pro MJLQ2LL/A Intel Core i7 2.20 GHz 16 GB Memory 256 GB SSD 15.4" Mac OS X v10.10 Yosemite,$4273.53,Free Shipping
Apple Macbook Pro 15" Intel Core i7-3615QM 2.30GHz Quad Core/4GB DDR3 Ram/500GB HDD/NVidia GeForce GT 650M 512MB Graphics/OSX 10.13 High Sierra A1286 MD103LL/A,$649.99,Free Shipping
Apple 15.4" MacBook Pro with Touch Bar (Mid 2018| Space Gray) Family Combo (3 Laptops + Accessories) Bundle - MR942LL/A,$8551.99,Free Shipping
Apple MacBook Pro| Mid 2015| 15in.| 2.5 GHz Core i7| 256 GB| Grade C| A1398,$890.93,Free Shipping
Apple 15.4" MacBook Pro with Touch Bar - 6-Core Intel® Core™ i9-8950HK 2.9GHz Processor (12M Cache) (up to 4.80 GHz)| 32GB RAM| 512GB SSD| Radeon Pro 560X| Space Gray (Mid 2018) A1990 MR942LL/A,$3249.00,Free Shipping
Refurbished: Apple C Grade Laptop MacBook Pro MD318LL/A-C Intel Core i7 2675QM (2.20 GHz) 4 GB Memory 500 GB HDD AMD Radeon HD 6750M 15.4" Mac OS X v10.7 Lion,$373.99,Free Shipping
Refurbished: Apple MacBook Pro MB990LL/A 13.3" Notebook - 2.26GHz Intel Core 2 Duo - 2GB 160GB - Mac OS X v10.6.3,$209.99,Free Shipping
Apple MacBook Pro 13" Core i7 3.5 GHz/16GB Memory/1TB SSD - Space Gray,$2499.99,Free Shipping
Refurbished: Apple C Grade Laptop (Mid 2012) MacBook Pro MD509LL/A-C Intel Core i5 2.50 GHz 4 GB Memory 500 GB HDD 13.3" Mac OS X v10.8 Mountain Lion,$549.99,Free Shipping
Refurbished: Apple MacBook Pro 15" - A1398 - Intel Core i7 2.6Ghz (3720QM) - 8GB RAM - 512GB SSD - 802.11n WiFi - NVIDIA GeForce GT650M - HDMI - Webcam - 15.4" Retina Display - MacOS Sierra installed,$786.00,Free Shipping
Refurbished: Apple MacBook Pro MD103LL/A Intel Core i7-3615QM X4 2.3GHz 8GB 500GB| Silver (Scratch and Dent),$579.00,Free Shipping
Refurbished: Mid 2015 15" MacBook Pro "Retina" 2.2GHz i7/16GB/256GB/Force Touch/IG/macOS MJLQ2LL/A,$979.00,Special Shipping
Refurbished: Apple Retina MacBook Pro 15" Core i7 2.8GHz 16GB RAM 256GB SSD MGXG2LL/A GRADE A,$1199.99,Free Shipping
Refurbished: Apple Grade A Laptop MacBook Pro MJLQ2LL/A Intel Core i7 2.20 GHz 16 GB Memory 256 GB SSD 15.4" Mac OS X v10.10 Yosemite,$1180.00,Free Shipping
Refurbished: Apple A Grade Macbook Pro 13.3-inch (Retina) 2.4Ghz Dual Core i5 ME865LL/A 256 GB SSD 8 GB Memory 2560x1600 Display macOS Sierra Power Adapter Included,$659.00,Free Shipping
Apple 13.3" MacBook Pro (Mid 2017| 128GB| Space Gray) Basic Bundle,$1206.99,Free Shipping
Refurbished: Mid-2015 15" MacBook Pro "Retina" 2.5GHz i7/16GB RAM/512GB Flash/AMD Radeon R9 M370X/Force Touch Trackpad/macOS - MJLT2LL/A,$1199.00,Special Shipping
Refurbished: Apple MacBook Pro Turbo 2.5Ghz i5 1TB SSD HYB 16GB MAX MEM High Sierra,$569.99,Special Shipping
Refurbished: Apple Mid 2014 15” MacBook Pro “Retina” 2.2GHz i7/16GB RAM/256GB Flash/Intel Iris 5200 Pro MGXA2LL/A - Grade B/C Cosmetics,$699.00,Special Shipping
Refurbished: Apple MacBook Pro 13.3" LED - Intel Core i5 2.5Ghz| NEW 240GB SSD| 8GB RAM| Webcam| AirPort Extreme| BT 4| MacOS MOJAVE - A1278 MD101LL/A (2012) - Wear/Tear,$425.00,Free Shipping
Used - Very Good: Apple Macbook Pro 15" Early 2011 Intel Core i7-5257U 2.70GHz Quad Core/16GB DDR3 Ram/320GB HDD/AMD Radeon HD 6490 Graphics/OSX 10.12 Sierra A1286 MC721LL/A,N/A,$22.05 Shipping
